{
  "id": "M0-REPO-07",
  "title": "Triage and merge the open Dependabot CI-action bumps (audit A1)",
  "milestone": "M0",
  "area": "REPO",
  "owner": "coordinator",
  "qa": null,
  "status": "done",
  "priority": "P2",
  "size": "S",
  "summary": "Five open Dependabot PRs (#1-5) bump GitHub Actions by major versions (actions/checkout 4->7, actions/setup-python 5->7, actions/setup-dotnet 4->6, actions/cache 4->6, game-ci/unity-builder 4->6). Supply-chain hygiene, but major bumps can change behavior. Rebase each onto main and merge only on green CI; hold any that breaks a workflow with a one-line note. Surfaced by the M0 audit (governance/checkpoints/M0.md, finding A1).",
  "deliverables": [
    ".github/workflows"
  ],
  "acceptance_tests": [
    {
      "id": "AT-1",
      "test": "Each open Dependabot action-bump PR (#1-5) is rebased onto main and merged only after its CI is green; any bump that breaks a workflow is held (not merged) with a one-line reason.",
      "evidence": "PR merge/hold notes",
      "automated": false,
      "level": "required"
    },
    {
      "id": "AT-2",
      "test": "After merges, the pinned action versions in .github/workflows/*.yml are current and all workflows still parse and pass on main.",
      "evidence": "green CI run on main",
      "automated": false,
      "level": "required"
    }
  ],
  "security": [
    "SECURITY_CHECKLIST §7 dependency pinning and audit"
  ],
  "depends_on": [],
  "references": [
    "governance/checkpoints/M0.md (audit A1)"
  ],
  "branch": "ticket/M0-REPO-07-action-bumps",
  "pr": null,
  "created": "2026-09-20",
  "updated": "2026-10-03",
  "history": [
    {
      "date": "2026-09-20",
      "event": "created by the Coordinator from the M0 audit (finding A1: open Dependabot CI-action bumps).",
      "by": "coordinator"
    },
    {
      "date": "2026-09-29",
      "event": "gj-operator: Dependabot #1/#2/#4/#5 applied in 87c38b1 (checkout v7, setup-python v7, setup-dotnet v6, cache v6); CI green on 76b943b (lint, governance, secret-scan, supabase-local, unity-tests; ios-build green up to the known TestFlight export step). #3 game-ci/unity-builder v6 HELD: runtime-downloaded CLI inside the job holding Unity licence + signing secrets, verifiable only via a full ios-build (Owner ASC key). QA: qa/reports/M0-REPO-07.md",
      "by": "gj-operator"
    },
    {
      "date": "2026-10-03",
      "event": "Coordinator secondary review (AUTH #027): AT-1 met (four bumps applied on green CI; #3 held with a documented reason) and AT-2 met (every push workflow parses + passes on main up to the known TestFlight signing step, unrelated to the bumps). The #3 hold (game-ci/unity-builder v6 downloads a CLI at runtime inside the job holding the Unity licence + Apple signing secrets) is endorsed as the safer call; now the Admin ASC key exists it can be re-evaluated via a full ios-build in a later round, with the upcoming upload/download-artifact + setup-node + gitleaks bumps (report section 'Still pinned'). Closing: in-review -> done.",
      "by": "coordinator"
    }
  ]
}
