{
  "id": "M0-LEGAL-04",
  "title": "Avatar SDK/MetaPerson data-retention and training terms (head vendor, on-prem, for M2)",
  "milestone": "M0",
  "area": "LEGAL",
  "owner": "gj-avatar",
  "qa": null,
  "status": "open",
  "priority": "P1",
  "size": "S",
  "summary": "Collect Avatar SDK/MetaPerson (itSeez3D) data-retention, training, deletion, and DPA terms and confirm fit for M2. Per AUTH #019 / ADR-0005 the head vendor is Avatar SDK on-prem 'Local Compute' (replaces Meshy/Tripo, dropped). Confirm the on-prem/no-train + DPA path before any face processing.",
  "deliverables": [
    "legal/vendors/avatar-sdk.md"
  ],
  "acceptance_tests": [
    {
      "id": "AT-1",
      "test": "legal/vendors/avatar-sdk.md records retention, deletion path, training-by-default and the on-prem/no-train option, DPA availability, region, with quotes, links, retrieval date.",
      "evidence": "files in PR",
      "automated": false,
      "level": "required"
    },
    {
      "id": "AT-2",
      "test": "An Avatar SDK/MetaPerson dossier (recognizability, generation time, Unity/iOS SDK, on-prem Local Compute, deletion guarantees, biometric-specific terms) confirms fit for M2; the head vendor is Avatar SDK (AUTH #019).",
      "evidence": "file section",
      "automated": false,
      "level": "required"
    },
    {
      "id": "AT-3",
      "test": "Any vendor that trains on customer images by default without an opt-out is marked 'do not use for user data'.",
      "evidence": "file line",
      "automated": false,
      "level": "required"
    }
  ],
  "security": [
    "SECURITY_CHECKLIST §6.3"
  ],
  "depends_on": [],
  "references": [
    "SPEC §3.2",
    "kit §3.4"
  ],
  "branch": null,
  "pr": null,
  "created": "2026-09-15",
  "updated": "2026-09-18",
  "history": [
    {
      "date": "2026-09-15",
      "event": "created by the Coordinator (M0 decomposition)",
      "by": "coordinator"
    },
    {
      "date": "2026-09-15",
      "event": "AUTH #003 applied: acceptance-criterion levels added; iOS-only wording",
      "by": "coordinator"
    },
    {
      "date": "2026-09-17",
      "event": "Owner selected Meshy as the head vendor (already holds an account); Tripo dropped. Scope reduced to a Meshy terms dossier; deliverables and acceptance tests updated to Meshy-only.",
      "by": "coordinator"
    },
    {
      "date": "2026-09-17",
      "event": "Meshy dossier landed (legal/vendors/meshy.md + research/vendors/meshy.md). Red flags: trains on non-Enterprise inputs by default; ToS bans identifiable-person photos; Free output is CC BY 4.0. Decision: USABLE WITH CONDITIONS (Enterprise + DPA + no-train + immediate source-photo deletion + PII carve-out; paid tier). Vendor-confirmed terms still required (§6.3) — status stays open.",
      "by": "coordinator"
    },
    {
      "date": "2026-09-18",
      "event": "Head vendor switched to Avatar SDK/MetaPerson on-prem (AUTH #019 / ADR-0005) — Meshy dropped after research showed its ToS bans identifiable-person photos. Retargeted title, summary, deliverable (legal/vendors/avatar-sdk.md), and AT-1/AT-2 to Avatar SDK; avatar-sdk.md filed from public terms. On-prem + DPA still to confirm (§6.3) — status stays open.",
      "by": "coordinator"
    }
  ]
}
