{
  "id": "M0-REPO-06",
  "title": "TestFlight lane in ios-build.yml (cloud-managed signing, fastlane pilot)",
  "milestone": "M0",
  "area": "REPO",
  "owner": "coordinator",
  "qa": null,
  "status": "done",
  "priority": "P1",
  "size": "S",
  "summary": "Harness: the macOS stage of ios-build gains a signed lane behind the TESTFLIGHT_ENABLED variable: archive with Xcode cloud-managed signing using the App Store Connect API key, export with method app-store-connect, upload with fastlane pilot; build number = run number; key material removed after the run. gj-qa-release verifies it on the first real run.",
  "acceptance_tests": [
    {
      "id": "AT-1",
      "test": "ios-build.yml has an `archive` (unsigned) lane when TESTFLIGHT_ENABLED is not true and a `testflight` lane when it is; both feed one `ios build gate` job; the workflow parses and the gate skips green while the Unity project is absent.",
      "evidence": "workflow file; Actions run on main",
      "automated": true,
      "level": "required"
    },
    {
      "id": "AT-2",
      "test": "The testflight lane fails fast with a clear message when any of ASC_KEY_ID, ASC_ISSUER_ID, ASC_KEY_P8_BASE64, APPLE_TEAM_ID is missing, and never echoes a key.",
      "evidence": "workflow step source",
      "automated": false,
      "level": "required"
    },
    {
      "id": "AT-3",
      "test": "First real run (after M0-UNITY-01 and M0-REPO-05): gj-qa-release confirms the build-number path (Info.plist CFBundleVersion) and the upload, records findings in qa/reports/ios-lane.md, and files fixes as a ticket if needed.",
      "evidence": "qa/reports/ios-lane.md",
      "automated": false,
      "level": "suggested"
    }
  ],
  "depends_on": [
    "M0-REPO-05"
  ],
  "references": [
    "SPEC §11",
    "M0-REPO-05"
  ],
  "branch": null,
  "pr": null,
  "created": "2026-09-15",
  "updated": "2026-10-02",
  "history": [
    {
      "date": "2026-09-15",
      "event": "created by the Coordinator (Owner selection of iPhone Duo candidates 1–3 and App Store Connect key confirmation, AUTH #003)",
      "by": "coordinator"
    },
    {
      "date": "2026-10-02",
      "event": "gj-operator: AT-3 first real TestFlight runs, recorded in qa/reports/ios-lane.md. Root cause of the failed uploads (builds 36/37): App Store Connect 409s for the iOS 17.5 SDK (iOS 26 SDK now required) and a missing 1024 px App Store icon. The API key, app record (6815794301) and build-number path were fine. Fixes 6578740 (macos-26 runners + Xcode 26 SDK guard, placeholder opaque App Store icon assigned to every iOS slot + export-time icon check, ITSAppUsesNonExemptEncryption=false) and 4d5aadc (icon smoke tests without UnityEditor.iOS). Uploaded: build 38 (release, run 37036868207), build 39 (release, run 37040933103 on 4d5aadc), build 40 (internal-debug, run 37046098523). Owner follow-ups: final icon art; confirm the export-compliance declaration.",
      "by": "gj-operator"
    },
    {
      "date": "2026-10-02",
      "event": "gj-operator: build 41 (release, run 37053104250 on 9b16f0f) uploaded to TestFlight at 2:48 PM CT. It is the first build with the M0-UNITY-03 / M1-UNITY-01 / M1-GAME-01 / M1-AVAT-01 stack. Recorded in qa/reports/ios-lane.md. Status unchanged (done).",
      "by": "gj-operator"
    }
  ],
  "notes": "Landed on main by the Coordinator (fast-forward, no PR) on 2026-09-15; unverified until a Unity project exists."
}
