{
  "id": "M0-SKILL-06",
  "title": "gj-platform: research handbook (RESOURCES.md + SKILLS.md)",
  "milestone": "M0",
  "area": "SKILL",
  "owner": "gj-platform",
  "qa": null,
  "status": "in-review",
  "priority": "P1",
  "size": "M",
  "summary": "First task before any ticket (kit §3 common block): research the top 100 resources on Supabase RLS patterns, Inngest, mobile backend security, CDN for large assets, event schema design, privacy-by-design; save an annotated list and distill a working handbook. Re-read SKILLS.md at every session start and update it when you learn something.",
  "deliverables": [
    "projects/skills/platform/RESOURCES.md",
    "projects/skills/platform/SKILLS.md"
  ],
  "acceptance_tests": [
    {
      "id": "AT-1",
      "test": "projects/skills/platform/RESOURCES.md lists at least 100 resources, each with title, URL, type (doc / paper / talk / repo / postmortem / vendor guide), and a one-line 'why it matters for GJ', grouped by the role's research focus.",
      "evidence": "file in PR; Coordinator counts entries",
      "automated": false,
      "level": "required"
    },
    {
      "id": "AT-2",
      "test": "projects/skills/platform/SKILLS.md covers: RLS-by-default patterns, idempotent Inngest steps, signed URL delivery, schema freezing, deletion flows, GPS/EXIF stripping; plus mistakes to avoid and the checklists you run before opening a PR.",
      "evidence": "file in PR",
      "automated": false,
      "level": "required"
    },
    {
      "id": "AT-3",
      "test": "SKILLS.md cites the repo rules it must follow (agents/grok/README.md, REVIEW_RUBRIC.md, SECURITY_CHECKLIST.md) and, where the role touches them, the Movement Bible and Design Skills sections by number.",
      "evidence": "file in PR",
      "automated": false,
      "level": "required"
    },
    {
      "id": "AT-4",
      "test": "SKILLS.md ends with a `## Session log` section (date, what was learned, what changed) that later sessions append to.",
      "evidence": "file in PR",
      "automated": false,
      "level": "required"
    },
    {
      "id": "AT-5",
      "test": "Branch is `setup/platform-skills`, the PR uses the template, secret-scan and lint are green, and no vendor keys or account details appear.",
      "evidence": "PR + CI links",
      "automated": true,
      "level": "required"
    }
  ],
  "depends_on": [],
  "references": [
    "kit §3 common block",
    "kit §3 role block"
  ],
  "branch": "setup/platform-skills",
  "pr": "https://github.com/BlissDirective/Gigantic-Journeys/pull/11",
  "created": "2026-09-15",
  "updated": "2026-09-26",
  "history": [
    {
      "date": "2026-09-15",
      "event": "created by the Coordinator (M0 decomposition)",
      "by": "coordinator"
    },
    {
      "date": "2026-09-15",
      "event": "AUTH #003 applied: acceptance-criterion levels added; iOS-only wording",
      "by": "coordinator"
    },
    {
      "date": "2026-09-24",
      "event": "Builder authored the working handbook (projects/skills/<role>/SKILLS.md) + a curated RESOURCES.md foundation; status -> in-progress (Owner-approved). The full annotated top-100 and the re-read/update-every-session discipline remain this role's ongoing task.",
      "by": "claude-builder"
    },
    {
      "date": "2026-09-26",
      "event": "gj-operator completed the handbook. RESOURCES.md has 104 link-checked entries (title, URL, type, why-for-GJ) grouped by the kit research focus (AT-1). SKILLS.md covers RLS-by-default patterns, idempotent Inngest steps, signed URL delivery, schema freezing, deletion flows and GPS/EXIF stripping, plus mistakes to avoid and pre-PR checklists (AT-2). Its §1 cites agents/grok/README.md, REVIEW_RUBRIC.md and SECURITY_CHECKLIST.md by section, and the Movement Bible / Design Skills sections by number where the role touches them (AT-3). It ends with a Session log (AT-4). Branch setup/platform-skills plus a templated PR; the change lands on main by fast-forward once the PR's CI is green (AT-5). Status -> in-review so the Coordinator can count entries (AT-1).",
      "by": "gj-operator"
    }
  ]
}
