{
  "id": "M0-UNITY-03",
  "title": "Traversal controller scaffold: five assemblies, movement.json loader, capsule locomotion and jump",
  "milestone": "M0",
  "area": "UNITY",
  "owner": "gj-gameplay",
  "qa": "gj-qa-release",
  "status": "in-review",
  "priority": "P0",
  "size": "L",
  "summary": "Lay down the movement architecture from Bible §2 as separate assemblies with the IVerbProvider seam, load config/movement.json at runtime, and prove locomotion plus standing/running jump with coyote time and jump buffering on a capsule in a flat test scene. No contact verbs yet (mantle, climb, hang are M1).",
  "scope_out": [
    "mantle, vault, hop-over, climb families, hang, slide, landing tiers (M1)",
    "motion matching database (M1-MOVE-01 spike)",
    "camera rules beyond a fixed follow (M1)"
  ],
  "acceptance_tests": [
    {
      "id": "AT-1",
      "test": "Assembly definitions GJ.Intent, GJ.TraversalQuery, GJ.AnimationSelection, GJ.MotionWarping, GJ.Procedural, and GJ.Movement.Shared (IVerbProvider, MoveClip ScriptableObject stub, MovementConfig) exist; references point only downward (an EditMode test asserting the reference graph is suggested).",
      "evidence": "asmdef files + test",
      "automated": true,
      "level": "required"
    },
    {
      "id": "AT-2",
      "test": "MovementConfig loads unity/Assets/StreamingAssets/movement.json at startup into typed fields; a missing or extra key is a hard error with a clear message (EditMode test).",
      "evidence": "test names",
      "automated": true,
      "level": "required"
    },
    {
      "id": "AT-3",
      "test": "Capsule walks/jogs/runs/sprints on the flat test scene at speeds within 2 % of the constants over a 5 s run (PlayMode test).",
      "evidence": "test names + log",
      "automated": true,
      "level": "suggested"
    },
    {
      "id": "AT-4",
      "test": "Standing jump reaches height 1.1 A ± 5 % and distance 1.2 A ± 5 %; running jump 1.2 A / 2.4 A; coyote window 100 ms and jump buffer 120 ms verified by EditMode tests on the intent layer.",
      "evidence": "test names",
      "automated": true,
      "level": "suggested"
    },
    {
      "id": "AT-5",
      "test": "Input: floating virtual stick in the left third and a jump button on touch, plus a Bluetooth/USB gamepad via the Input System; both drive the same intent layer.",
      "evidence": "gj-qa-release clip + screenshot",
      "automated": false,
      "level": "required"
    },
    {
      "id": "AT-6",
      "test": "Test scene meets the SPEC §6 targets on the Owner's iPhones (a debug-overlay measurement is suggested).",
      "evidence": "Profiler screenshot in qa/evidence/M0-UNITY-03/",
      "automated": false,
      "level": "suggested"
    },
    {
      "id": "AT-7",
      "test": "No movement or camera constant is hard-coded; every number comes from MovementConfig (grep check in the PR).",
      "evidence": "grep output in PR",
      "automated": false,
      "level": "required"
    }
  ],
  "design": [
    "Bible §2 architecture",
    "Bible §3.1, §3.3",
    "Bible §10",
    "Design Skills rule 17–18"
  ],
  "depends_on": [
    "M0-UNITY-01",
    "M0-MOVE-01"
  ],
  "references": [
    "Bible §2, §3, §10",
    "kit START M0 (controller scaffold)"
  ],
  "branch": "ticket/M0-UNITY-03-traversal-controller",
  "pr": null,
  "created": "2026-09-15",
  "updated": "2026-09-29",
  "history": [
    {
      "date": "2026-09-15",
      "event": "created by the Coordinator (M0 decomposition)",
      "by": "coordinator"
    },
    {
      "date": "2026-09-15",
      "event": "AUTH #003 applied: acceptance-criterion levels added; iOS-only wording",
      "by": "coordinator"
    },
    {
      "date": "2026-09-28",
      "event": "Built by gj-operator (overnight worker, Owner: 'proceed with all remaining autonomous tasks') and committed directly to main (fast-forward model, AUTH #006/#007): 732de3f (code, tests, scene) + the evidence/docs commit. Seven assemblies (GJ.Movement.Shared, GJ.Intent, GJ.TraversalQuery, GJ.AnimationSelection, GJ.MotionWarping, GJ.Procedural + GJ.Movement.Controller composition root), references only downward; strict MovementConfig loader for StreamingAssets/movement.json (missing/unknown/duplicate/wrong-type keys are hard errors naming the path); touch floating stick + 72 pt jump pad and Input System gamepad merged into one intent layer; gait bands, coyote time, jump buffer; IVerbProvider registry + locomotion verbs; capsule motor with committed ballistic jumps; fixed follow camera; MovementTest scene (1:12 flat floor). Local EditMode 95/95, PlayMode 17/17 (+1 explicit evidence capture). AT-1, AT-2 met; AT-3 met (walk/jog/run/sprint 1.200/2.400/3.600/4.500 A/s over 5 s); AT-4 met (standing 1.100 A / 1.228 A, running 1.200 A / 2.406 A; coyote 100 ms and buffer 120 ms boundary tests); AT-5 met in the Editor with simulated touch + gamepad (qa/evidence/M0-UNITY-03/01, 02) — device clip pending; AT-6 not measured (needs TestFlight on an Owner iPhone); AT-7 met for every movement.json constant, but the Bible §3.1/§8 stick-band and camera numbers have no movement.json section, so they sit in one file (ProvisionalTuning.cs, enforced by an EditMode literal scan) pending AUTH: governance/auth-requests/M0-UNITY-03-movement-json-intent-camera.md. QA: PASS WITH DEFECTS (non-blocking), qa/reports/M0-UNITY-03.md. For Coordinator review.",
      "by": "gj-operator"
    },
    {
      "date": "2026-09-29",
      "event": "gj-operator follow-up (QA D1 + M1-DUO-01 BACKLOG item a): ControlCustomization (56–96 pt buttons, opacity, left-handed mirror, drag offset, PlayerPrefs store + Reset) applied by TouchLayout with safe-area/stick-zone clamping; active stick cancelled on safe-area change (Duo fold/Split View). EditMode 151/151 (17 new), PlayMode 18/18 (+1 new). Settings › Controls screen still needs M0-DSGN-02 tokens. Status unchanged (in-review).",
      "by": "gj-operator"
    }
  ]
}
